<?xml version="1.0" encoding="UTF-8"?>
<xs:schema xmlns:xs="http://www.w3.org/2001/XMLSchema">
    <xs:element name="alumnos">
        <xs:complexType> 
            <xs:sequence>
                <xs:element name="alumno" maxOccurs="unbounded">
                    <xs:complexType>
                    <xs:sequence>
                        <xs:element name="nombre" type="xs:string"></xs:element>
                        <xs:element name="nacimiento" type="xs:date"></xs:element>
                    </xs:sequence>
                        <xs:attribute name="correo"></xs:attribute>
                    </xs:complexType>
                </xs:element>
            </xs:sequence>
        </xs:complexType>
    </xs:element>
</xs:schema>